{
  "schema_version": "0.2",
  "change_id": "EC-F002-F004-F009-REPAIR",
  "title": "Repair authoritative change resolution and fixture isolation",
  "state": "ready",
  "lane": "governance",
  "change_kind": "governance",
  "task_start_revision": "104cb51b3637d3f2fd26cfbf2f310cbbcdd4cf16",
  "intent": {
    "outcome": "External task-start and Git provenance select one authoritative contract; every governance test case owns isolated Git state.",
    "recovery": "Fail closed on missing or inconsistent provenance and always clean only the case-owned temporary repository."
  },
  "scope": {
    "allowed_paths": [
      ".agentinfra/changes/EC-F002-F004-F009-REPAIR.json",
      "scripts/lib/ExecutableConstitution.psm1",
      "scripts/new-change.ps1",
      "scripts/check-change-spec.ps1",
      "scripts/check-scope.ps1",
      "scripts/check-protected-paths.ps1",
      "scripts/test-executable-constitution.ps1",
      "docs/change-contract.md",
      "docs/agent-workflow.md",
      "docs/decisions/0005-authoritative-change-contract-resolution.md",
      "docs/decisions/README.md",
      ".agentinfra/README.md",
      ".agentinfra/changes/README.md"
    ],
    "forbidden_paths": [
      "Cargo.toml",
      "Cargo.lock",
      "crates/**",
      ".github/**",
      ".agentinfra/policy.json",
      ".agentinfra/schemas/**",
      "AGENTS.md",
      "scripts/check.ps1"
    ],
    "expected_crates": []
  },
  "budgets": {
    "new_crates": 0,
    "dependency_manifest_files": 0,
    "new_manifests": 0,
    "new_unsafe_boundaries": 0,
    "protected_files": 8,
    "workflow_files": 0,
    "public_architecture_layers": 0
  },
  "architecture": {
    "changes_owner_or_dependency_direction": false,
    "changes_async_or_resource_lifecycle": false,
    "changes_platform_boundary": false,
    "changes_dependencies": false,
    "changes_protocol_or_persistence": true,
    "changes_privacy_or_sensitive_data": false,
    "changes_unsafe_boundary": false,
    "changes_public_architecture_layers": false,
    "adr_paths": [
      "docs/decisions/0005-authoritative-change-contract-resolution.md"
    ]
  },
  "verification": {
    "profile": "governance",
    "required_checks": [
      "change-spec",
      "scope",
      "protected-paths",
      "policy",
      "executable-constitution-self-tests",
      "repository-full-gate"
    ]
  },
  "protected_change": true,
  "residual_risks": [
    "Candidate-local checks do not establish Hosted Trust and require independent audit replay."
  ],
  "owner_decisions": [
    "Governance outcome remains review_required until independent owner review."
  ],
  "exclusions": [
    "No product, dependency, workflow, hosted trust, evidence bundle, GitHub setting, or unrelated finding changes."
  ]
}
