{
  "schema_version": "0.2",
  "change_id": "EC-V02-CORE",
  "title": "Install the local v0.2 Executable Constitution core",
  "state": "ready",
  "lane": "governance",
  "change_kind": "governance",
  "task_start_revision": "91fc0dd1b97dd2c79adf64a57a0977ca746c92e0",
  "intent": {
    "outcome": "The repository deterministically rejects unauthorized scope, budget, and protected-path changes while preserving its existing quality gate.",
    "recovery": "Each governance control is isolated in a local commit that can be reverted without changing product runtime behavior."
  },
  "scope": {
    "allowed_paths": [
      ".agentinfra/**",
      ".github/pull_request_template.md",
      "AGENTS.md",
      "docs/agent-task-template.md",
      "docs/agent-workflow.md",
      "docs/change-contract.md",
      "docs/decisions/0004-executable-constitution-core.md",
      "docs/decisions/README.md",
      "docs/product-identity.md",
      "docs/testing-standard.md",
      "scripts/check-agent-contract.ps1",
      "scripts/check-change-spec.ps1",
      "scripts/check-commit-message.ps1",
      "scripts/check-commits.ps1",
      "scripts/check-policy.ps1",
      "scripts/check-protected-paths.ps1",
      "scripts/check-scope.ps1",
      "scripts/init-project.ps1",
      "scripts/lib/ExecutableConstitution.psm1",
      "scripts/new-change.ps1",
      "scripts/product-identity.psm1",
      "scripts/test-executable-constitution.ps1",
      "scripts/test-generated-project.ps1",
      "scripts/test-policy-scripts.ps1",
      "scripts/test-product-identity.ps1"
    ],
    "forbidden_paths": [
      ".github/CODEOWNERS",
      ".github/workflows/**",
      "Cargo.lock",
      "Cargo.toml",
      "crates/**"
    ],
    "expected_crates": []
  },
  "budgets": {
    "new_crates": 0,
    "dependency_manifest_files": 0,
    "new_manifests": 0,
    "new_unsafe_boundaries": 0,
    "protected_files": 30,
    "workflow_files": 0,
    "public_architecture_layers": 0
  },
  "architecture": {
    "changes_owner_or_dependency_direction": false,
    "changes_async_or_resource_lifecycle": false,
    "changes_platform_boundary": false,
    "changes_dependencies": false,
    "changes_protocol_or_persistence": true,
    "changes_privacy_or_sensitive_data": false,
    "changes_unsafe_boundary": false,
    "changes_public_architecture_layers": false,
    "adr_paths": ["docs/decisions/0004-executable-constitution-core.md"]
  },
  "verification": {
    "profile": "governance",
    "required_checks": [
      "change-spec",
      "scope",
      "protected-paths",
      "policy",
      "executable-constitution-self-tests",
      "repository-full-gate"
    ]
  },
  "protected_change": true,
  "residual_risks": [
    "Core validation is candidate-local until the separately authorized Trust stage.",
    "Git copy-source reporting remains an explicit similarity heuristic."
  ],
  "owner_decisions": [],
  "exclusions": [
    "No product runtime, crate, dependency, lockfile, hosted workflow, repository setting, push, merge, or release change.",
    "Structured Evidence, CODEOWNERS, Branch Rulesets, Required Checks, Eval Replay, and Governance Lite remain deferred."
  ]
}
